<?xml version="1.0"?>
<!DOCTYPE RAVEN SYSTEM "raven.dtd">
<RAVEN>
    <Assets>
        <Textures/>
        <Music/>
        <Sounds/>
        <Fonts/>
        <Animations/>
        <Renderables>
            <RenderableTexts/>
            <RenderableRectangles/>
            <RenderableCircles/>
            <RenderableSprites/>
        </Renderables>
    </Assets>
  <Prefabs>
    <PEntity>
      <PData>
        <PName>Base Entity</PName>
        <PPrefabName>Base Entity</PPrefabName>
        <PModified>0</PModified>
      </PData>
      <PTransform>
        <PSubTransform>
          <PTransformX>0.000000</PTransformX>
          <PTransformY>0.000000</PTransformY>
        </PSubTransform>
        <PRotation>0.000000</PRotation>
      </PTransform>
      <PRigidbody>
        <PVelocity>
          <PVelocityX>0.000000</PVelocityX>
          <PVelocityY>0.000000</PVelocityY>
        </PVelocity>
        <PAcceleration>
          <PAccelerationX>0.0000000</PAccelerationX>
          <PAccelerationY>0.0000000</PAccelerationY>
        </PAcceleration>
        <PRadialVelocity>0.000000</PRadialVelocity>
      </PRigidbody>
    </PEntity>
  </Prefabs>
    <Levels>
      <Level Name="Default Level">
      </Level>
    </Levels>
</RAVEN>
